{
  "$schema": "https://json-schema.org/draft/2020-12/schema",
  "$id": "https://orthic.labs/schemas/cortex-admission-v1.json",
  "title": "CortexAdmissionDecisionV1",
  "type": "object",
  "additionalProperties": false,
  "required": [
    "schemaVersion",
    "action",
    "reason",
    "reasonCode",
    "receiptId",
    "allowedScopes",
    "omissions",
    "claimBoundary",
    "nextAction"
  ],
  "properties": {
    "schemaVersion": { "const": 1 },
    "action": { "enum": ["allow", "continue", "block", "noop"] },
    "reason": { "type": "string" },
    "reasonCode": { "type": ["string", "null"] },
    "receiptId": { "type": ["string", "null"] },
    "candidateSet": { "type": ["object", "null"] },
    "allowedScopes": {
      "type": "array",
      "items": { "type": "string" }
    },
    "omissions": {
      "type": "array",
      "items": { "type": "object" }
    },
    "claimBoundary": {
      "type": "object",
      "additionalProperties": false,
      "required": [
        "status",
        "cleanClaimAllowed",
        "safeClaims",
        "prohibitedClaims",
        "gaps"
      ],
      "properties": {
        "status": { "enum": ["clear", "restricted"] },
        "cleanClaimAllowed": { "type": "boolean" },
        "safeClaims": {
          "type": "array",
          "items": { "type": "string" }
        },
        "prohibitedClaims": {
          "type": "array",
          "items": { "type": "string" }
        },
        "gaps": {
          "type": "array",
          "items": { "type": "string" }
        }
      }
    },
    "nextAction": { "type": ["string", "null"] },
    "evidence": { "type": ["object", "null"] },
    "evidencePath": { "type": ["string", "null"] },
    "receipt": { "type": ["object", "null"] }
  }
}
